{
  "bindings": {},
  "candidate_id": "ee40698c0be7ed25",
  "dsl": "tilelang",
  "lowerable": false,
  "origin": "static-discovery",
  "recipe_id": "ee40698c0be7ed25-unresolved",
  "schema_version": "pipeguard-upstream-recipe-v1",
  "target": {
    "arch": "sm_90a",
    "backend": "cuda",
    "warp_size": 32
  },
  "unresolved": [
    "A",
    "accum_dtype",
    "concrete_specialization",
    "dtype",
    "num_threads"
  ]
}
