{
  "bindings": {
    "dtype": "float16",
    "label": "llama-8b-prefill",
    "manifest": "src/tileops/manifest/normalization.yaml",
    "normalized_shape": [
      4096
    ],
    "operator": "LayerNormFwdOp",
    "row_index": 0,
    "x_shape": [
      2048,
      4096
    ]
  },
  "candidate_id": "174c56dd4b98cfe6",
  "compiler": {
    "binding_evidence": {
      "end_line": 108,
      "function": "LayerNormFwdOp",
      "kind": "MANIFEST_WORKLOAD",
      "path": "src/tileops/manifest/normalization.yaml",
      "selected_cta": [
        0,
        0,
        0
      ],
      "source_sha256": "7781ec61047ade6f3226ea60f52b0cb9b026872ce3ca1736365483432bf23c0c",
      "start_line": 57,
      "upstream_commit": "6a4085cddb32f9a0f22bc8c99c2bbadbceff7226"
    }
  },
  "dsl": "tilelang",
  "lowerable": false,
  "origin": "upstream-manifest_workload:src/tileops/manifest/normalization.yaml:57-108#LayerNormFwdOp",
  "recipe_id": "tileops-6a4085cd-root-174c56dd4b98cfe6-original-acc6bdcc35-recipe",
  "reference": {
    "mode": "not_run"
  },
  "schema_version": "pipeguard-upstream-recipe-v1",
  "target": {
    "arch": "sm_90a",
    "backend": "cuda",
    "warp_size": 32
  },
  "unresolved": [
    "native_factory_materialization",
    "source_specification_to_kernel_binding"
  ]
}
