{
  "bindings": {},
  "candidate_id": "b8d0975f2fbff613",
  "dsl": "tilelang",
  "lowerable": false,
  "origin": "static-discovery",
  "recipe_id": "b8d0975f2fbff613-unresolved",
  "schema_version": "pipeguard-upstream-recipe-v1",
  "target": {
    "arch": "sm_90a",
    "backend": "cuda",
    "warp_size": 32
  },
  "unresolved": [
    "concrete_specialization"
  ]
}
