{
  "bindings": {},
  "candidate_id": "9f1e2323da518ba7",
  "dsl": "tilelang",
  "lowerable": false,
  "origin": "static-discovery",
  "recipe_id": "9f1e2323da518ba7-unresolved",
  "schema_version": "pipeguard-upstream-recipe-v1",
  "target": {
    "arch": "sm_90a",
    "backend": "cuda",
    "warp_size": 32
  },
  "unresolved": [
    "_conv3d_group_body",
    "c_in",
    "c_in_g",
    "c_out",
    "concrete_specialization",
    "d_in",
    "dtype",
    "h_in",
    "kernel_d",
    "kernel_h",
    "kernel_w",
    "n",
    "out_d",
    "out_h",
    "out_w",
    "w_in"
  ]
}
