{
  "bindings": {},
  "candidate_id": "8bf6107dfdcfd3d5",
  "dsl": "triton",
  "lowerable": false,
  "origin": "static-discovery",
  "recipe_id": "8bf6107dfdcfd3d5-unresolved",
  "schema_version": "pipeguard-upstream-recipe-v1",
  "target": {
    "arch": "sm90",
    "backend": "cuda",
    "warp_size": 32
  },
  "unresolved": [
    "concrete_specialization"
  ]
}
