{
  "bindings": {},
  "candidate_id": "9323778fd79e2c39",
  "dsl": "tilelang",
  "lowerable": false,
  "origin": "static-discovery",
  "recipe_id": "9323778fd79e2c39-unresolved",
  "schema_version": "pipeguard-upstream-recipe-v1",
  "target": {
    "arch": "sm_90a",
    "backend": "cuda",
    "warp_size": 32
  },
  "unresolved": [
    "concrete_specialization"
  ]
}
