{
  "bindings": {},
  "candidate_id": "3693bd8c09b06d74",
  "dsl": "tilelang",
  "lowerable": false,
  "origin": "static-discovery",
  "recipe_id": "3693bd8c09b06d74-unresolved",
  "schema_version": "pipeguard-upstream-recipe-v1",
  "target": {
    "arch": "sm_90a",
    "backend": "cuda",
    "warp_size": 32
  },
  "unresolved": [
    "A_shared_shape",
    "A_sparse_shape",
    "B_shape",
    "B_shared_shape",
    "E_factor",
    "E_shape",
    "E_shared_shape",
    "K",
    "M",
    "N",
    "accum_dtype",
    "block_K",
    "block_M",
    "block_N",
    "concrete_specialization",
    "in_dtype",
    "metadata_dtype",
    "num_stages",
    "out_dtype",
    "threads",
    "trans_A",
    "trans_B"
  ]
}
