{
  "bindings": {},
  "candidate_id": "e725389cd587d53c",
  "dsl": "triton",
  "lowerable": false,
  "origin": "static-discovery",
  "recipe_id": "e725389cd587d53c-unresolved",
  "schema_version": "pipeguard-upstream-recipe-v1",
  "target": {
    "arch": "sm90",
    "backend": "cuda",
    "warp_size": 32
  },
  "unresolved": [
    "concrete_specialization"
  ]
}
