{
  "bindings": {},
  "candidate_id": "d7bd0e7cf10af5d1",
  "dsl": "tilelang",
  "lowerable": false,
  "origin": "static-discovery",
  "recipe_id": "d7bd0e7cf10af5d1-unresolved",
  "schema_version": "pipeguard-upstream-recipe-v1",
  "target": {
    "arch": "sm_90a",
    "backend": "cuda",
    "warp_size": 32
  },
  "unresolved": [
    "N_total",
    "a_numel",
    "a_strides",
    "b_numel",
    "b_strides",
    "block_size",
    "concrete_specialization",
    "divisors",
    "dtype",
    "ndim",
    "num_per_thread",
    "op_func",
    "out_dtype",
    "threads"
  ]
}
