{
  "bindings": {},
  "candidate_id": "1e41d3b7fbcbbee6",
  "compiler": {
    "pass_configs": {},
    "target_host": null
  },
  "dsl": "tilelang",
  "lowerable": true,
  "materialization": {
    "args": [],
    "kwargs": {},
    "mode": "direct",
    "resolver_kwargs": {}
  },
  "origin": "static-inference:no-unresolved-primfunc-bindings",
  "recipe_id": "1e41d3b7fbcbbee6-sm90a-static-primfunc",
  "reference": {
    "mode": "reference_replay"
  },
  "schema_version": "pipeguard-upstream-recipe-v1",
  "target": {
    "arch": "sm_90a",
    "backend": "cuda",
    "warp_size": 32
  },
  "unresolved": []
}
