{
  "bindings": {},
  "candidate_id": "5781c24e3bdd70e0",
  "dsl": "tilelang",
  "lowerable": false,
  "origin": "static-discovery",
  "recipe_id": "5781c24e3bdd70e0-unresolved",
  "schema_version": "pipeguard-upstream-recipe-v1",
  "target": {
    "arch": "sm_90a",
    "backend": "cuda",
    "warp_size": 32
  },
  "unresolved": [
    "K",
    "M",
    "N",
    "accum_dtype",
    "block_K",
    "block_M",
    "block_N",
    "concrete_specialization",
    "dtype",
    "enable_rasteration",
    "num_stages",
    "thread_num"
  ]
}
